{
  "design_id": "clean_fixed_readmission",
  "design_type": "fixed",
  "question": "퇴원 시각에, 30일 안에 다시 입원할지 예측",
  "tp": {"anchor": "discharge", "offsets_h": [0]},
  "outcome": {
    "name": "readmit_30d",
    "definition": "next_admission",
    "description": "퇴원 후 30일 안에 같은 환자의 입원이 시작됨",
    "source": "admissions",
    "scope": "next_admission",
    "time_column": "admit_time",
    "window": {"start": "tp", "end": "tp+30d"}
  },
  "cohort": {
    "index_time": "tp",
    "inclusion": [
      {"name": "adult", "source": "patients", "column": "age", "agg": "value", "op": ">=", "value": 18}
    ],
    "exclusion": [
      {"name": "died_in_hospital", "source": "admissions", "column": "discharge_status",
       "agg": "value", "op": "==", "value": "died"}
    ],
    "subgroups": ["unit"]
  },
  "features": [
    {"name": "age", "source": "patients", "column": "age", "agg": "value"},
    {"name": "sex", "source": "patients", "column": "sex", "agg": "value"},
    {"name": "unit", "source": "admissions", "column": "unit", "agg": "value"},
    {"name": "los_h", "source": "admissions", "column": "length_of_stay_h", "agg": "value"},
    {"name": "discharge_status", "source": "admissions", "column": "discharge_status", "agg": "value"},
    {"name": "dx_ckd", "source": "diagnoses", "filter": {"icd_code": ["N18"]}, "agg": "any"},
    {"name": "dx_chf", "source": "diagnoses", "filter": {"icd_code": ["I50"]}, "agg": "any"},
    {"name": "n_dx", "source": "diagnoses", "agg": "count"},
    {"name": "n_prior_adm", "source": "admissions", "scope": "prior_admissions", "agg": "count"},
    {"name": "cr_last", "source": "labs", "filter": {"test": ["creatinine"]},
     "time_column": "report_time", "window": {"start": "admit", "end": "tp"}, "agg": "last"},
    {"name": "hgb_min", "source": "labs", "filter": {"test": ["hemoglobin"]},
     "time_column": "report_time", "window": {"start": "admit", "end": "tp"}, "agg": "min"},
    {"name": "dialysis_ordered", "source": "orders", "filter": {"order_type": ["dialysis_order"]},
     "time_column": "order_time", "window": {"start": "admit", "end": "tp"}, "agg": "any"}
  ],
  "split_unit": "patient",
  "split": {"key": "patient_id", "method": "group_holdout", "test_fraction": 0.3, "seed": 20261002},
  "preprocessing": [
    {"name": "median_impute", "kind": "impute", "fit_scope": "train"},
    {"name": "one_hot", "kind": "encode", "fit_scope": "train"},
    {"name": "standardize", "kind": "scale", "fit_scope": "train"}
  ],
  "model": {"family": "logistic_regression",
            "tuning": {"method": "group_kfold", "cv_key": "patient_id", "fit_scope": "train"}},
  "attempts": {"n_designs_tried": 1, "n_models_tried": 1, "correction": "none"}
}
